Row #,apc_2012_2013_results.csv PMCID,processed_apc_2012_2013.csv PMCID,apc_2012_2013.csv PMCID,apc_2012_2013.csv PMID,apc_2012_2013.csv DOI,apc_2012_2013.csv Article title
26,FALSE,,none,,10.1017/S0001972013000478,Tarmacking in the milleninum city: spatial and temporal tralectories of empowerment in Kenya.
28,FALSE,,none,none,10.1017/S0007087413000332,"Writing, printing, speaking: Rhesus blood-group genetics and nomenclatures in the mid-twentieth century"
74,FALSE,,PMC3673232,,10.2105/AJPH.2012.300939,Health co-benefits and transportation-related reductions in greenhouse gas emissions in the San Francisco bay area
201,TRUE,,,,,The Therapeutic Potential of Allosteric Ligands for Free Fatty Acid Sensitive GPCRs
1854,FALSE,,none,23873369,10.1387/ijdb.130046jw,The Dictyostelium prestalk inducer DIF-1 directs phosphorylation of a bZIP transcription factor.

Row #,apc_2012_2013_results.csv Licence,processed_apc_2012_2013.csv Licence,apc_2012_2013.csv PMCID,apc_2012_2013.csv PMID,apc_2012_2013.csv DOI,apc_2012_2013.csv Article title
2,cc by,cc-by,PMC3671369,,10.1057/9781137377029,"Health Economists, Tobacco Control and International Development: On the Economisation of Global Health beyond Neoliberal Structural Adjustment Policies"
3,cc by-nc,cc-by-nc,PMC3724273,,10.1177/0952695112468526,The pursuit of happiness: the social and scientific origins of Hans Selye’s natural philosophy of life’
4,cc by,cc-by,PMC3627513,,10.1177/0952695112470350,War on fear: Solly Zuckerman and civilian nerve in World War II
11,cc by,cc-by,PMC3627511,,10.1177/0952695112471658,The invention of the psychosocial: an introduction
12,cc by,cc-by,PMC3652708,,10.1177/0952695112473619,Making the cut: the production of 'self-harm' in post-1945 Anglo-Saxon psychiatry
13,cc by-nc,cc-by-nc,PMC3757918,,10.1177/0952695113484320,How autism became autism: the radical transformation of a central concept of child development in Britain
14,unknown,cc-by,not available,,10.1177/0265691413479085,Images and Meaning - Making in a World of Resemblance: The Bavarian-Saxon Kidney Stone Affair of 1580.
15,cc by,cc-by,PMC3865968,,10.1017/mdh.2013.63,International health and the limits of its global influence: Bhutan and the worldwide smallpox eradication
17,cc by,cc-by,PMC3865946,,10.1017/mdh.2013.20,"A Textbook Pattern? Malarai Eradication and Control, Jamaica 1910-1965"
18,non-standard-licence,unknown,PMC3483757,,10.1017/mdh.2012.30,Mrs Killer and Dr Crook: birth attendants and birth outcomes in early twentieth century Derbyshire
19,non-standard-licence,cc-by,PMC3566749,,10.1017/mdh.2012.81,"I've Never Found Doctors to be a Difficult Bunch': Doctors, Managers and NHS Reorganisations in Manchester and Salford, 1948-2007"
20,cc by,cc-by,PMC3606566,,10.1107/S1744309113002352,Structure of Pseudomonas aeruginosa inosine 5'-monophosphate dehydrogenase
21,cc by,cc-by,PMC3668577,,10.1107/S174430911301292X,Structure of diaminohydroxyphosphoribosylaminopyrimidine deaminase/5-amino-6-(5-phosphoribosylamino)uracil reductase from Acinetobacter baumannii.
22,non-standard-licence,unknown,none,23072351,10.1021/ac302223s,Amphipathic polymers facilitate the study of functional membrane in the gas phase
23,cc by,cc-by,PMC3374517,,10.1107/S1744309112010330,Crystallization and preliminary crystallographic analysis of the major capsid proteins VP16 and VP17 of bacteriophage P23-77
24,unknown,cc-by,none,,10.1017/S0001972013000442,"Stuck in ruins, or up and coming?"
25,unknown,cc-by,none,,10.1017/S0001972013000454,"Pharmacy, money and public health in Dakar."
27,cc by-nc-sa,cc-by-nc-sa,PMC3948080,23158229,10.1017/S1355617712000768,Effects of Maternal Worm Infections and Anthelminthic Treatment during Pregnancy on Infant Motor and Neurocognitive Functioning
29,cc by,cc-by,PMC3930469,,10.1177/1363459313476966,Re-valuing donor and recipient bodies in the globalised blood economy: transitions in public policy on blood safety in the UK
30,non-standard-licence,cc-by,none,20146481,10.1021/jm901827x,Toward biophysical probes for the 5-HT3 receptor: structure-activity relationship study of granisetron derivatives
31,cc by,cc-by,PMC3766112,,10.1186/1756-0500-6-344,"Prevalence of schistosome antibodies and hepatosplenic signs and symptoms among patients from Kaoma, Western Province, Zambia"
33,cc by,cc-by,PMC3348006,,10.1186/1478-7547-10-5,Cost and cost effectiveness of long-lasting insecticide-treated bed nets - a model-based analysis
34,cc by,cc-by,PMC3744815,,10.1016/j.ejmg.2013.05.001,The internet is parents' main source of information about psychiatric manifestationsof 22q11.2 deletion syndrome
35,cc by,cc-by,PMC3750443,,10.1186/1472-6939-14-27,Taking ethical photos of children for medical and research purposes in low-resource settings: an exploratory qualitative study
36,cc by,cc-by,PMC3664635,,10.1186/1472-6963-13-195,Community groups as 'critical enablers' of the HIV response in Zimbabwe
37,cc by,cc-by,PMC3312863,,10.1186/1472-6963-12-42,The development of a lay health worker delivered collaborative community based intervention for people with schizophrenia in India
38,cc by,cc-by,PMC3765690,,10.1186/1742-6405-10-20,Collective Patient behaviours derailing ART rool-out in KwaZulu-Natal: Perspectives of Health Care Providers
39,cc-nc,cc-by-nc,none,22879016,10.1007/978-1-4614-4989-8_10,Normobaric hyperoxia does not change optical scattering or pathlength but does increase oxidised cytochrome C oxidase concentration in patients with brain injury
40,cc-nc,cc-by-nc,none,22879019,10.1007/978-1-4614-4989-8_13,Modelling Cerebrovascular Reactivity: A Novel Near-Infrared Biomarker of Cerebral Autoregulation?
41,cc-nc,cc-by-nc,none,22879021,10.1007/978-1-4614-4989-8_15,Oscillations in cerebral haemodynamics in patients with falciparum malaria
42,cc-nc,cc-by-nc,none,22879034,10.1007/978-1-4614-4989-8_28,Wavelet cross-correlation to investigate regional variations in cerebral oxygenation in infants supported on extracorporeal membrane oxygenation
43,cc by,cc-by,PMC3751770,,none,Socio-economic position and childhood multimorbidity: a study using linkage between the Avon Longitudinal Study of Parents and Children and the General Practice Research Database
45,cc by,cc-by,PMC3528429,,10.1186/1746-6148-8-234,"Prevalence of porcine cysticercosis and associated risk factors in Homa Bay District, Kenya"
46,cc by,cc-by,PMC3716626,,10.1186/1297-9716-44-46,Understanding foot-and-mouth disease virus transmission biology: identification of the indicators of infectiousness
48,cc by-nc,cc-by-nc,PMC3536734,,10.4161/chan.22153,State-independent intracellular access of quatemary ammonium blockers to the pore of TREK-1
50,cc by,cc-by,PMC3798815,,10.1152/japplphysiol.00777.2013,Development and validation of anthropometric prediction equation for estimation of lean body mass and appendicular lean soft tissue in Indian mean and women.
51,cc by,cc-by,PMC3571806,,10.3390/s121216695,Wearable and Implantable Sensors: The Patient's Perspective
52,cc by-nc,cc-by-nc,PMC3633361,,10.1093/alcalc/agt006,Post-treatment stage of change predicts 12-month outcome of treatment for alcohol problems
54,cc by,cc-by,PMC3599138,,10.1186/1471-2458-13-147,A retrospective study of Human Immunodeficincy Virus transmission mortality and loss to follow-up among infants in the first 18 months of life in prevention of mother-t-child transmission programme in an urban hospital in KwaZulu-Natal South Africa
55,cc by,cc-by,PMC3717731,,10.3390/ijerph10062185,Tobacco use and nicotine dependence among conflict-affected men in Georgia.
56,cc by,cc-by,PMC3598237,,10.1186/1476-511X-11-155,Evaluation of seven common lipid associated loci in a large indian sib pair study
57,cc by,cc-by,PMC3721994,,10.1186/1478-4491-11-34,Absenteeism amongst health workers - developing a typology to support empiric work in low-income countries and characterizing reported associations.
58,cc by,cc-by,PMC3529683,,10.1186/1478-4491-10-39,Human resources needs for universal access to antiretroviral therapy in South Africa: A time-motion study
60,cc by,cc-by,PMC3533981,,10.1186/1471-2458-12-991,Geographical access to care at birth n Ghana: a barrier to safe motherhood
61,cc by,cc-by,PMC3637528,,10.1186/1471-2458-13-354,The role of community conversations in facilitating local HIV competence: Case study from rural Zimbabwe
62,cc by,cc-by,PMC3664085,,10.1186/1471-2458-13-490,"Evidence of improving antiretroviral therapy treatment delays: an analysis of eight years of programmatic outcomes in Blantyre, Malawi"
63,cc by,cc-by,PMC3735389,,10.1186/1471-2458-13-706,Association between legume intake and self-reported diabetes among adult men and women in India.
64,cc by,cc-by,PMC3844357,,10.1186/1471-2458-13-769,Education is associated with lower levels of abdominal obesity in women with a non-agricultural occupation: an interaction study using China's Four Provinces survey
65,cc by,cc-by,PMC3844310,,10.1186/1471-2458-13-802,Do accurate HIV and antiretroviral therapy knowledge and previous testing experiences increase the uptake o ....
66,cc by,cc-by,none,24456668,10.1186/1471-2458-13-949,Alcohol assessment and feedback by e-mail for university student hazardous and harmful drinkers: study protocol for the AMADEUS-2 randomised controlled trials.
67,non-standard-licence,unknown,none,23668184,10.1037/a0032570,Asymmetry in the Discrimination of Length During Spatial Learning
68,cc by,cc-by,PMC3637551,,10.1186/1471-2458-13-342,Social acceptability and perceived impact of a community-led cash transfer programme in Zimbabwe
69,cc by,cc-by,PMC3570447,,10.1186/1471-2458-12-980,Tuberculosis and poverty: the contribution of patients costs in sub-Saharan Africa - a systematic review
70,cc by,cc-by,PMC3599138,,10.1186/1471-2458-13-147,Maternal HIV disclosure to HIV- uninfected children in rural South Africa: a pilot study of family-based intervention
71,cc by,cc-by,PMC3651303,,10.1186/1471-2458-13-397,Older HIV-infected individuals present late and have a higher mortality: Brighton UK cohort study
72,cc by,cc-by,PMC3846679,,10.1186/1471-2458-13-817,Intimate partner violence against women during and after pregnancy: a cross-sectional study in Mumbai slums
73,cc by,cc-by,PMC3848687,,10.1186/1471-2458-13-835,The effectiveness of mental health promotion interventions for young people in low and middle income countries: a systematic review.
75,cc by-nc,cc-by-nc,PMC3397896,,10.1074/jbc.M112.377101,Annexin A1 Interaction with the FPR2/ALX Receptor
76,cc by,cc-by,PMC3642319,,10.1074/jbc.M112.419911,Biochemical and immunological characterisation of Toxoplasma gondii macrophage migration inhibitory factor
77,cc by-nc,cc-by-nc,PMC3137072,,10.1074/jbc.M111.242263,"Characterisation of GAS2-like 3, a new microtubule and actin-binding protein related to spectraplakins"
78,cc by-nc,cc-by-nc,PMC3522295,,10.1074/jbc.M112.386938,Constitutional mutations in RTEL1 cause severe dyskeratosis congenita
79,cc by,cc-by,PMC3751660,,10.1186/1471-2458-13-757,Implementation of an educational intervention to improve hand washing in primary schools: process evaluation within a randomised controlled trial
80,cc by-nc,cc-by-nc,PMC3581401,,10.1074/jbc.M112.416347,Molecular Architecture of a Complex between an Adhesion Protein from the Malaria Parasite and Intracellular Adhesion Molecule 1
81,cc by,cc-by,PMC3789947,,10.1074/jbc.M113.497149,Mechanism for Recognition of an Unusual Mycobacterial Glycolipid
82,cc by,cc-by,PMC3711325,,10.1074/jbc.M113.479642,Glycoprotein biosynthesis in a eukaryote lacking the membrane protein rft1
83,cc by,cc-by,PMC3642348,,10.1074/jbc.M112.414367,Human and viral golgi anti-apoptotic protein (GAAP) oligomerize via different mechanisms and monomeric GAAP inhibits apoptosis and modulates calcium
84,cc by-nc,cc-by-nc,PMC3561585,,10.1074/jbc.M112.415372,Distinct roles in autophagy and importance in infectivity of the two ATG4 cysteine peptidases of Leishmania major
85,cc by,cc-by,PMC3682533,,10.1074/jbc.M113.455337,Defining the molecular basis for the first potent and selective orthosteric agonists of the FFA2 free fatty acid receptor
86,cc by-nc,cc-by-nc,PMC3493908,,10.1074/jbc.M112.373969,Dynamic exchange of myosin VI on endocytic structures
87,cc by-nc,cc-by-nc,PMC3531760,,10.1074/jbc.M112.422402,Contrasting Effects of a-synuclein and y-synuclein on the Phenotype of Cysteine String Protein alpha (CSPa) Null Mutant Mice Suggest Distinct Function of these Proteins in Neuronal Synapses
88,cc by-nc,cc-by-nc,PMC3436574,,10.1074/jbc.M112.381541,Structural Requirements for Recognition of Major Histocompatibility Complex Class II by Membrane-associated RING-CH (MARCH) Protein E3 Ligases
89,cc by-nc,cc-by-nc,PMC3516716,,10.1074/jbc.M112.405407,"Novel keto-phospholipids are generated by monocytes and macrophages. Detected in Cystic Fibrosis, and activate peroxisome proliferator-activated receptor-? (Manuscript #M405409)"
90,cc by,cc-by,PMC3795252,,10.1074/jbc.M112.424846,SLP-76 sterile alpha motif (SAM) and individual H alpha helix mediates oligomer formation for microclusters and T-cell activation
91,cc by,cc-by,PMC3663556,,10.1074/jbc.M112.427765,Endomembrane HRas controls vascular endothelial growth factor-induced nitric oxide synthase-mediated endothelial cell migration
92,cc by,cc-by,PMC3757190,,10.1074/jbc.M113.492017,Fused in Sarcoma (FUS) Protein Lacking Nuclear Localization Signal (NLS) and Major RNA Binding Motifs Triggers Proteinopathy
93,cc by-nc,cc-by-nc,PMC3581394,,10.1074/jbc.M112.423012,Immobilization of Heparan Sulfate on Electrospun Meshes to Support Embryonic Stem Cell Culture and Differentiation
94,cc by-nc,cc-by-nc,PMC2757965,,10.1074/jbc.M109.030338,Mechanisms of activity-dependent plasticity in cellular nitric oxide-cGMP signaling
95,cc by-nc,cc-by-nc,PMC2962504,,10.1074/jbc.M110.154443,Structural and Functional Investigations of Matrilin-1 A-domains Reveal Insights into Their Role in Cartilage ECM Assembly
96,cc by-nc,cc-by-nc,PMC3268392,,10.1074/jbc.M111.306563,Photoaffinity labelling of high affinity nicotinic acid adenine dinucleotide 2'-phosphate (NAADP) proteins in sea urchin egg
97,cc by-nc,cc-by-nc,PMC3554938,,10.1074/jbc.M112.422238,Deubiquitinases regulate the activity of caspase-1 and IL-1β secretion via assembly of the inflammasome
98,cc by-nc,cc-by-nc,PMC3234717,,10.1074/jbc.M111.272419,Methionine Oxidation of Sup35 Protein Induces Formation of the [PSI+] Prion in a Yeast Peroxiredoxin Mutant
99,cc by-nc,cc-by-nc,PMC3591638,,10.1074/jbc.M112.428854,Molecular Basis for Jagged-1 Serrate
100,cc by,cc-by,PMC3696646,,10.1074/jbc.M113.463372,Comparative Proteomic Analysis of Supportive and Unsupportive Extracellular Matrix Substrates for Human Embryonic Stem Cell Maintenance.
101,cc by-nc,cc-by-nc,PMC3234811,,10.1074/jbc.M111.289777,Picomolar nitric oxide signals from central neurons recorded using ultrasensitive detector cells
102,cc by,cc-by,PMC3772201,,10.1074/jbc.M113.485409,Galactose 6-o-sulfotransferases are not required for the generation of siglec-f ligands in leukocytes or lung tissue.
103,cc by,cc-by,PMC3682544,,10.1074/jbc.M113.469841,STRUCTURAL ANALYSIS OF COLLAGEN TYPE I INTERACTIONS WITH HUMAN FIBRONECTIN REVEALS A COOPERATIVE BONDING MODE
104,cc by,cc-by,PMC3663545,,10.1074/jbc.M113.461137,Allosteric activation of trypanosomatid deoxyhypusine synthase by a catalytically dead paralog
105,cc by-nc,cc-by-nc,PMC3597819,,10.1074/jbc.M112.437996,Structural Basis for Cul3 Protein Assembly with the BTB-Kelch Family of E3 Ubiquitin Ligases
106,cc by-nc,cc-by-nc,PMC3431625,,10.1074/jbc.M111.331157,Opticin Exerts Its Anti-Angiogenic Activity by Regulating Extracellular Matrix Adhesiveness
107,cc by-nc,cc-by-nc,PMC3488092,,10.1074/jbc.M112.402289,Solution NMR Structure of the Ca2+- Bound N-Terminal Domain of Calcium Binding Protein 7 (CaBP7): A regulator of Golgi trafficking
108,cc by-nc,cc-by-nc,PMC3308871,,10.1074/jbc.M111.283689,Structural and evolutionary basis for the dual substrate selectivity of human KDM4 histone demethylase family.
109,cc by-nc,cc-by-nc,PMC3527912,,10.1074/jbc.M112.422089,Structural and functional characterisation of the kindlin-1 pleckstrin homology domain
110,cc by-nc,cc-by-nc,PMC3265891,,10.1074/jbc.M111.313015,Structural and kinetic evidence that catalytic reaction of human UDP-glucose 6-dehydrogenase involves covalent thiohemiacetal and thioester enzyme intermediates.
111,cc by-nc,cc-by-nc,PMC3234852,,10.1074/jbc.M111.270751,Inhibitory member of the apoptosis-stimulating proteins of the p53 family (iASPP) interacts with protein phosphatase 1 via a noncanonical binding motif.
112,cc by,cc-by,PMC3774408,,10.1074/jbc.M113.464651,"P2X receptor chimeras highlight roles of the amino terminus to partial agonist efficacy, the carboxyl terminus to recovery from desensitization, and independent regulation of channel transitions"
113,cc by-nc,cc-by-nc,PMC3591641,,10.1074/jbc.M112.447524,Expanding the repertoire of amyloiod polymorphs by co-polymerization of related protein precursors
114,cc by-nc,cc-by-nc,PMC2952269,,10.1074/jbc.M110.128256,SSS1p is required to complete protein translocon activation
115,cc by-nc,cc-by-nc,PMC3121340,,10.1074/jbc.M111.219568,Preferential Targeting of a Signal Recognition Particle-dependent Precursor
116,cc by,cc-by,PMC3774368,,10.1074/jbc.M112.445346,Functional properties of five Dictyostelium discoideum P2X receptors
117,cc by,cc-by,PMC3665474,,10.1186/1471-2458-13-497,Walking and cycling to work despite reporting an unsupportive environment: insights from a mixed-method exploration of resilience
118,cc by,cc-by,PMC3600532,,10.1111/zph.12000,Ecology of zoonotic infectious diseases in bats: current knowledge and future directions
119,cc by,cc-by,PMC3190389,,10.1186/1743-422X-8-442,Label-free quantitative proteomics reveals regulation of interferon-induced protein with tetratricopeptide repeats 3 (IFIT3) and 5'-3'-exoribonuclease 2 (XRN2) during respiratory syncytial virus infection.
140,cc by-nc,cc-by-nc,PMC3173209,,10.1074/jbc.M111.219212,The T cell receptor triggering apparatus is composed of monovalent or monomeric proteins.

Row #,apc_2012_2013_results.csv Licence source,processed_apc_2012_2013.csv Licence Source,apc_2012_2013.csv PMCID,apc_2012_2013.csv PMID,apc_2012_2013.csv DOI,apc_2012_2013.csv Article title
2,epmc_rest_api,epmc_xml,PMC3671369,,10.1057/9781137377029,"Health Economists, Tobacco Control and International Development: On the Economisation of Global Health beyond Neoliberal Structural Adjustment Policies"
3,epmc_rest_api,epmc_xml,PMC3724273,,10.1177/0952695112468526,The pursuit of happiness: the social and scientific origins of Hans Selye’s natural philosophy of life’
4,epmc_rest_api,epmc_xml,PMC3627513,,10.1177/0952695112470350,War on fear: Solly Zuckerman and civilian nerve in World War II
5,unknown,,none,,10.1126/science.1228160,"High coverage of ART associated with decline in risk of HIV acquisition in rural KwaZulu-Natal, South Africa"
6,unknown,,PMC3860268,,10.1126/science.1230413,Increase in adult life expectancy
7,unknown,,PMC3672848,,10.4049/jimmunol.1201510,Mitochondrial superoxide generation enhances P2X7R-mediated loss of cell surface CD62L on naive human CD4+ T lymphocytes.
8,unknown,,PMC3549224,,10.4049/jimmunol.1202438,Chronic Exposure to Plasmodium falciparum Is Associated with Phenotypic Evidence of B and T Cell Exhaustion
9,unknown,,PMC3619528,,10.4049/jimmunol.1202611,Candida albicans primes the Toll-like receptor cytokine responses through a dectin-1/Ref-1-mediated pathway
10,unknown,,PMC3607403,,10.4049/jimmunol.1203389,GRB2-Mediated Recruitment of THEMIS to LAT Is Essential for Thymocyte Development
11,epmc_rest_api,epmc_xml,PMC3627511,,10.1177/0952695112471658,The invention of the psychosocial: an introduction
12,epmc_rest_api,epmc_xml,PMC3652708,,10.1177/0952695112473619,Making the cut: the production of 'self-harm' in post-1945 Anglo-Saxon psychiatry
13,epmc_rest_api,publisher,PMC3757918,,10.1177/0952695113484320,How autism became autism: the radical transformation of a central concept of child development in Britain
14,unknown,publisher,not available,,10.1177/0265691413479085,Images and Meaning - Making in a World of Resemblance: The Bavarian-Saxon Kidney Stone Affair of 1580.
15,epmc_rest_api,epmc_xml,PMC3865968,,10.1017/mdh.2013.63,International health and the limits of its global influence: Bhutan and the worldwide smallpox eradication
16,epmc_xml_permissions,epmc_xml,PMC3542187,,10.1017/mdh.2013.17,The Research Council System and The Politics of Medical and Agricultural Research for the British Colonial Empire 1940-1952
17,epmc_rest_api,epmc_xml,PMC3865946,,10.1017/mdh.2013.20,"A Textbook Pattern? Malarai Eradication and Control, Jamaica 1910-1965"
18,epmc_xml_permissions,,PMC3483757,,10.1017/mdh.2012.30,Mrs Killer and Dr Crook: birth attendants and birth outcomes in early twentieth century Derbyshire
19,epmc_xml_permissions,publisher,PMC3566749,,10.1017/mdh.2012.81,"I've Never Found Doctors to be a Difficult Bunch': Doctors, Managers and NHS Reorganisations in Manchester and Salford, 1948-2007"
20,epmc_rest_api,epmc_xml,PMC3606566,,10.1107/S1744309113002352,Structure of Pseudomonas aeruginosa inosine 5'-monophosphate dehydrogenase
21,epmc_rest_api,epmc_xml,PMC3668577,,10.1107/S174430911301292X,Structure of diaminohydroxyphosphoribosylaminopyrimidine deaminase/5-amino-6-(5-phosphoribosylamino)uracil reductase from Acinetobacter baumannii.
22,epmc_xml_permissions,,none,23072351,10.1021/ac302223s,Amphipathic polymers facilitate the study of functional membrane in the gas phase
23,epmc_rest_api,epmc_xml,PMC3374517,,10.1107/S1744309112010330,Crystallization and preliminary crystallographic analysis of the major capsid proteins VP16 and VP17 of bacteriophage P23-77
24,unknown,epmc_xml,none,,10.1017/S0001972013000442,"Stuck in ruins, or up and coming?"
25,unknown,epmc_xml,none,,10.1017/S0001972013000454,"Pharmacy, money and public health in Dakar."
26,unknown,,none,,10.1017/S0001972013000478,Tarmacking in the milleninum city: spatial and temporal tralectories of empowerment in Kenya.
27,epmc_rest_api,epmc_xml,PMC3948080,23158229,10.1017/S1355617712000768,Effects of Maternal Worm Infections and Anthelminthic Treatment during Pregnancy on Infant Motor and Neurocognitive Functioning
28,unknown,,none,none,10.1017/S0007087413000332,"Writing, printing, speaking: Rhesus blood-group genetics and nomenclatures in the mid-twentieth century"
29,epmc_rest_api,epmc_xml,PMC3930469,,10.1177/1363459313476966,Re-valuing donor and recipient bodies in the globalised blood economy: transitions in public policy on blood safety in the UK
30,epmc_xml_permissions,epmc_xml,none,20146481,10.1021/jm901827x,Toward biophysical probes for the 5-HT3 receptor: structure-activity relationship study of granisetron derivatives
31,epmc_rest_api,epmc_xml,PMC3766112,,10.1186/1756-0500-6-344,"Prevalence of schistosome antibodies and hepatosplenic signs and symptoms among patients from Kaoma, Western Province, Zambia"
32,epmc_xml_permissions,epmc_xml,PMC3444173,,10.1037/a0027006,Investigating cognitive pathways to psychopathology: predicting depression and posttraumatic stress disorder from early responses after assault
33,epmc_rest_api,epmc_xml,PMC3348006,,10.1186/1478-7547-10-5,Cost and cost effectiveness of long-lasting insecticide-treated bed nets - a model-based analysis
34,epmc_rest_api,epmc_xml,PMC3744815,,10.1016/j.ejmg.2013.05.001,The internet is parents' main source of information about psychiatric manifestationsof 22q11.2 deletion syndrome
35,epmc_rest_api,epmc_xml,PMC3750443,,10.1186/1472-6939-14-27,Taking ethical photos of children for medical and research purposes in low-resource settings: an exploratory qualitative study
36,epmc_rest_api,epmc_xml,PMC3664635,,10.1186/1472-6963-13-195,Community groups as 'critical enablers' of the HIV response in Zimbabwe
37,epmc_rest_api,epmc_xml,PMC3312863,,10.1186/1472-6963-12-42,The development of a lay health worker delivered collaborative community based intervention for people with schizophrenia in India
38,epmc_rest_api,epmc_xml,PMC3765690,,10.1186/1742-6405-10-20,Collective Patient behaviours derailing ART rool-out in KwaZulu-Natal: Perspectives of Health Care Providers
39,epmc_xml_permissions,epmc_xml,none,22879016,10.1007/978-1-4614-4989-8_10,Normobaric hyperoxia does not change optical scattering or pathlength but does increase oxidised cytochrome C oxidase concentration in patients with brain injury
40,epmc_xml_permissions,epmc_xml,none,22879019,10.1007/978-1-4614-4989-8_13,Modelling Cerebrovascular Reactivity: A Novel Near-Infrared Biomarker of Cerebral Autoregulation?
41,epmc_xml_permissions,epmc_xml,none,22879021,10.1007/978-1-4614-4989-8_15,Oscillations in cerebral haemodynamics in patients with falciparum malaria
42,epmc_xml_permissions,epmc_xml,none,22879034,10.1007/978-1-4614-4989-8_28,Wavelet cross-correlation to investigate regional variations in cerebral oxygenation in infants supported on extracorporeal membrane oxygenation
43,epmc_rest_api,epmc_xml,PMC3751770,,none,Socio-economic position and childhood multimorbidity: a study using linkage between the Avon Longitudinal Study of Parents and Children and the General Practice Research Database
44,epmc_xml_permissions,epmc_xml,PMC3646404,,10.1021/pr400086y,Global quantitative SILAC phosphoproteomics reveals differential phosphorylation is widespread between the procyclic and bloodstream form lifecycle stages of Trypanosoma brucei.
45,epmc_rest_api,epmc_xml,PMC3528429,,10.1186/1746-6148-8-234,"Prevalence of porcine cysticercosis and associated risk factors in Homa Bay District, Kenya"
46,epmc_rest_api,epmc_xml,PMC3716626,,10.1186/1297-9716-44-46,Understanding foot-and-mouth disease virus transmission biology: identification of the indicators of infectiousness
