Row #,apc_2012_2013_results.csv PMCID,processed_apc_2012_2013.csv PMCID,apc_2012_2013.csv PMCID,apc_2012_2013.csv PMID,apc_2012_2013.csv DOI,apc_2012_2013.csv Article title
47,epmc_xml_permissions,epmc_xml,PMC3576129,,10.1037/a0031190,The nature of nuture: Disentangling passive geneotype-environment correlation from family relationship influences on children's externalising problems
48,epmc_rest_api,epmc_xml,PMC3536734,,10.4161/chan.22153,State-independent intracellular access of quatemary ammonium blockers to the pore of TREK-1
49,epmc_xml_permissions,epmc_xml,PMC3330789,,10.1152/ajpheart.00357.2011,Altered sinoatrial node function and intra-atrial conduction in murine gain-of-function Scn5a+/ΔKPQ hearts suggest an overlap syndrome.
50,epmc_rest_api,epmc_xml,PMC3798815,,10.1152/japplphysiol.00777.2013,Development and validation of anthropometric prediction equation for estimation of lean body mass and appendicular lean soft tissue in Indian mean and women.
51,epmc_rest_api,epmc_xml,PMC3571806,,10.3390/s121216695,Wearable and Implantable Sensors: The Patient's Perspective
52,epmc_rest_api,epmc_xml,PMC3633361,,10.1093/alcalc/agt006,Post-treatment stage of change predicts 12-month outcome of treatment for alcohol problems
54,epmc_rest_api,epmc_xml,PMC3599138,,10.1186/1471-2458-13-147,A retrospective study of Human Immunodeficincy Virus transmission mortality and loss to follow-up among infants in the first 18 months of life in prevention of mother-t-child transmission programme in an urban hospital in KwaZulu-Natal South Africa
55,epmc_rest_api,epmc_xml,PMC3717731,,10.3390/ijerph10062185,Tobacco use and nicotine dependence among conflict-affected men in Georgia.
56,epmc_rest_api,epmc_xml,PMC3598237,,10.1186/1476-511X-11-155,Evaluation of seven common lipid associated loci in a large indian sib pair study
57,epmc_rest_api,epmc_xml,PMC3721994,,10.1186/1478-4491-11-34,Absenteeism amongst health workers - developing a typology to support empiric work in low-income countries and characterizing reported associations.
58,epmc_rest_api,epmc_xml,PMC3529683,,10.1186/1478-4491-10-39,Human resources needs for universal access to antiretroviral therapy in South Africa: A time-motion study
59,epmc_xml_permissions,epmc_xml,PMC3613719,,10.1186/1471-2458-13-152,Effectiveness of alcohol brief intervention delivered by community pharmacists: study protocol of a two-arm randomised controlled trial.
60,epmc_rest_api,epmc_xml,PMC3533981,,10.1186/1471-2458-12-991,Geographical access to care at birth n Ghana: a barrier to safe motherhood
61,epmc_rest_api,epmc_xml,PMC3637528,,10.1186/1471-2458-13-354,The role of community conversations in facilitating local HIV competence: Case study from rural Zimbabwe
62,epmc_rest_api,epmc_xml,PMC3664085,,10.1186/1471-2458-13-490,"Evidence of improving antiretroviral therapy treatment delays: an analysis of eight years of programmatic outcomes in Blantyre, Malawi"
63,epmc_rest_api,epmc_xml,PMC3735389,,10.1186/1471-2458-13-706,Association between legume intake and self-reported diabetes among adult men and women in India.
64,epmc_rest_api,epmc_xml,PMC3844357,,10.1186/1471-2458-13-769,Education is associated with lower levels of abdominal obesity in women with a non-agricultural occupation: an interaction study using China's Four Provinces survey
65,epmc_rest_api,epmc_xml,PMC3844310,,10.1186/1471-2458-13-802,Do accurate HIV and antiretroviral therapy knowledge and previous testing experiences increase the uptake o ....
66,epmc_rest_api,epmc_xml,none,24456668,10.1186/1471-2458-13-949,Alcohol assessment and feedback by e-mail for university student hazardous and harmful drinkers: study protocol for the AMADEUS-2 randomised controlled trials.
67,epmc_xml_permissions,,none,23668184,10.1037/a0032570,Asymmetry in the Discrimination of Length During Spatial Learning
68,epmc_rest_api,epmc_xml,PMC3637551,,10.1186/1471-2458-13-342,Social acceptability and perceived impact of a community-led cash transfer programme in Zimbabwe
69,epmc_rest_api,epmc_xml,PMC3570447,,10.1186/1471-2458-12-980,Tuberculosis and poverty: the contribution of patients costs in sub-Saharan Africa - a systematic review
70,epmc_rest_api,epmc_xml,PMC3599138,,10.1186/1471-2458-13-147,Maternal HIV disclosure to HIV- uninfected children in rural South Africa: a pilot study of family-based intervention
71,epmc_rest_api,epmc_xml,PMC3651303,,10.1186/1471-2458-13-397,Older HIV-infected individuals present late and have a higher mortality: Brighton UK cohort study
72,epmc_rest_api,epmc_xml,PMC3846679,,10.1186/1471-2458-13-817,Intimate partner violence against women during and after pregnancy: a cross-sectional study in Mumbai slums
73,epmc_rest_api,epmc_xml,PMC3848687,,10.1186/1471-2458-13-835,The effectiveness of mental health promotion interventions for young people in low and middle income countries: a systematic review.
74,unknown,,PMC3673232,,10.2105/AJPH.2012.300939,Health co-benefits and transportation-related reductions in greenhouse gas emissions in the San Francisco bay area
75,epmc_rest_api,epmc_xml,PMC3397896,,10.1074/jbc.M112.377101,Annexin A1 Interaction with the FPR2/ALX Receptor
76,epmc_rest_api,epmc_xml,PMC3642319,,10.1074/jbc.M112.419911,Biochemical and immunological characterisation of Toxoplasma gondii macrophage migration inhibitory factor
77,epmc_rest_api,epmc_xml,PMC3137072,,10.1074/jbc.M111.242263,"Characterisation of GAS2-like 3, a new microtubule and actin-binding protein related to spectraplakins"
78,epmc_rest_api,epmc_xml,PMC3522295,,10.1074/jbc.M112.386938,Constitutional mutations in RTEL1 cause severe dyskeratosis congenita
79,epmc_rest_api,epmc_xml,PMC3751660,,10.1186/1471-2458-13-757,Implementation of an educational intervention to improve hand washing in primary schools: process evaluation within a randomised controlled trial
80,epmc_rest_api,epmc_xml,PMC3581401,,10.1074/jbc.M112.416347,Molecular Architecture of a Complex between an Adhesion Protein from the Malaria Parasite and Intracellular Adhesion Molecule 1
81,epmc_rest_api,epmc_xml,PMC3789947,,10.1074/jbc.M113.497149,Mechanism for Recognition of an Unusual Mycobacterial Glycolipid
82,epmc_rest_api,epmc_xml,PMC3711325,,10.1074/jbc.M113.479642,Glycoprotein biosynthesis in a eukaryote lacking the membrane protein rft1
83,epmc_rest_api,epmc_xml,PMC3642348,,10.1074/jbc.M112.414367,Human and viral golgi anti-apoptotic protein (GAAP) oligomerize via different mechanisms and monomeric GAAP inhibits apoptosis and modulates calcium
84,epmc_rest_api,epmc_xml,PMC3561585,,10.1074/jbc.M112.415372,Distinct roles in autophagy and importance in infectivity of the two ATG4 cysteine peptidases of Leishmania major
85,epmc_rest_api,epmc_xml,PMC3682533,,10.1074/jbc.M113.455337,Defining the molecular basis for the first potent and selective orthosteric agonists of the FFA2 free fatty acid receptor
86,epmc_rest_api,epmc_xml,PMC3493908,,10.1074/jbc.M112.373969,Dynamic exchange of myosin VI on endocytic structures
87,epmc_rest_api,epmc_xml,PMC3531760,,10.1074/jbc.M112.422402,Contrasting Effects of a-synuclein and y-synuclein on the Phenotype of Cysteine String Protein alpha (CSPa) Null Mutant Mice Suggest Distinct Function of these Proteins in Neuronal Synapses
88,epmc_rest_api,epmc_xml,PMC3436574,,10.1074/jbc.M112.381541,Structural Requirements for Recognition of Major Histocompatibility Complex Class II by Membrane-associated RING-CH (MARCH) Protein E3 Ligases
89,epmc_rest_api,epmc_xml,PMC3516716,,10.1074/jbc.M112.405407,"Novel keto-phospholipids are generated by monocytes and macrophages. Detected in Cystic Fibrosis, and activate peroxisome proliferator-activated receptor-? (Manuscript #M405409)"
90,epmc_rest_api,epmc_xml,PMC3795252,,10.1074/jbc.M112.424846,SLP-76 sterile alpha motif (SAM) and individual H alpha helix mediates oligomer formation for microclusters and T-cell activation
91,epmc_rest_api,epmc_xml,PMC3663556,,10.1074/jbc.M112.427765,Endomembrane HRas controls vascular endothelial growth factor-induced nitric oxide synthase-mediated endothelial cell migration
92,epmc_rest_api,epmc_xml,PMC3757190,,10.1074/jbc.M113.492017,Fused in Sarcoma (FUS) Protein Lacking Nuclear Localization Signal (NLS) and Major RNA Binding Motifs Triggers Proteinopathy
93,epmc_rest_api,epmc_xml,PMC3581394,,10.1074/jbc.M112.423012,Immobilization of Heparan Sulfate on Electrospun Meshes to Support Embryonic Stem Cell Culture and Differentiation
94,epmc_rest_api,epmc_xml,PMC2757965,,10.1074/jbc.M109.030338,Mechanisms of activity-dependent plasticity in cellular nitric oxide-cGMP signaling
95,epmc_rest_api,epmc_xml,PMC2962504,,10.1074/jbc.M110.154443,Structural and Functional Investigations of Matrilin-1 A-domains Reveal Insights into Their Role in Cartilage ECM Assembly
96,epmc_rest_api,epmc_xml,PMC3268392,,10.1074/jbc.M111.306563,Photoaffinity labelling of high affinity nicotinic acid adenine dinucleotide 2'-phosphate (NAADP) proteins in sea urchin egg
97,epmc_rest_api,epmc_xml,PMC3554938,,10.1074/jbc.M112.422238,Deubiquitinases regulate the activity of caspase-1 and IL-1β secretion via assembly of the inflammasome
98,epmc_rest_api,epmc_xml,PMC3234717,,10.1074/jbc.M111.272419,Methionine Oxidation of Sup35 Protein Induces Formation of the [PSI+] Prion in a Yeast Peroxiredoxin Mutant
99,epmc_rest_api,epmc_xml,PMC3591638,,10.1074/jbc.M112.428854,Molecular Basis for Jagged-1 Serrate
100,epmc_rest_api,epmc_xml,PMC3696646,,10.1074/jbc.M113.463372,Comparative Proteomic Analysis of Supportive and Unsupportive Extracellular Matrix Substrates for Human Embryonic Stem Cell Maintenance.
101,epmc_rest_api,epmc_xml,PMC3234811,,10.1074/jbc.M111.289777,Picomolar nitric oxide signals from central neurons recorded using ultrasensitive detector cells
102,epmc_rest_api,epmc_xml,PMC3772201,,10.1074/jbc.M113.485409,Galactose 6-o-sulfotransferases are not required for the generation of siglec-f ligands in leukocytes or lung tissue.
103,epmc_rest_api,epmc_xml,PMC3682544,,10.1074/jbc.M113.469841,STRUCTURAL ANALYSIS OF COLLAGEN TYPE I INTERACTIONS WITH HUMAN FIBRONECTIN REVEALS A COOPERATIVE BONDING MODE
104,epmc_rest_api,epmc_xml,PMC3663545,,10.1074/jbc.M113.461137,Allosteric activation of trypanosomatid deoxyhypusine synthase by a catalytically dead paralog
105,epmc_rest_api,epmc_xml,PMC3597819,,10.1074/jbc.M112.437996,Structural Basis for Cul3 Protein Assembly with the BTB-Kelch Family of E3 Ubiquitin Ligases
106,epmc_rest_api,epmc_xml,PMC3431625,,10.1074/jbc.M111.331157,Opticin Exerts Its Anti-Angiogenic Activity by Regulating Extracellular Matrix Adhesiveness
107,epmc_rest_api,epmc_xml,PMC3488092,,10.1074/jbc.M112.402289,Solution NMR Structure of the Ca2+- Bound N-Terminal Domain of Calcium Binding Protein 7 (CaBP7): A regulator of Golgi trafficking
108,epmc_rest_api,epmc_xml,PMC3308871,,10.1074/jbc.M111.283689,Structural and evolutionary basis for the dual substrate selectivity of human KDM4 histone demethylase family.
109,epmc_rest_api,epmc_xml,PMC3527912,,10.1074/jbc.M112.422089,Structural and functional characterisation of the kindlin-1 pleckstrin homology domain
110,epmc_rest_api,epmc_xml,PMC3265891,,10.1074/jbc.M111.313015,Structural and kinetic evidence that catalytic reaction of human UDP-glucose 6-dehydrogenase involves covalent thiohemiacetal and thioester enzyme intermediates.
111,epmc_rest_api,epmc_xml,PMC3234852,,10.1074/jbc.M111.270751,Inhibitory member of the apoptosis-stimulating proteins of the p53 family (iASPP) interacts with protein phosphatase 1 via a noncanonical binding motif.
112,epmc_rest_api,epmc_xml,PMC3774408,,10.1074/jbc.M113.464651,"P2X receptor chimeras highlight roles of the amino terminus to partial agonist efficacy, the carboxyl terminus to recovery from desensitization, and independent regulation of channel transitions"
113,epmc_rest_api,epmc_xml,PMC3591641,,10.1074/jbc.M112.447524,Expanding the repertoire of amyloiod polymorphs by co-polymerization of related protein precursors
114,epmc_rest_api,epmc_xml,PMC2952269,,10.1074/jbc.M110.128256,SSS1p is required to complete protein translocon activation
115,epmc_rest_api,epmc_xml,PMC3121340,,10.1074/jbc.M111.219568,Preferential Targeting of a Signal Recognition Particle-dependent Precursor
116,epmc_rest_api,epmc_xml,PMC3774368,,10.1074/jbc.M112.445346,Functional properties of five Dictyostelium discoideum P2X receptors
117,epmc_rest_api,epmc_xml,PMC3665474,,10.1186/1471-2458-13-497,Walking and cycling to work despite reporting an unsupportive environment: insights from a mixed-method exploration of resilience
118,epmc_rest_api,epmc_xml,PMC3600532,,10.1111/zph.12000,Ecology of zoonotic infectious diseases in bats: current knowledge and future directions
119,epmc_rest_api,epmc_xml,PMC3190389,,10.1186/1743-422X-8-442,Label-free quantitative proteomics reveals regulation of interferon-induced protein with tetratricopeptide repeats 3 (IFIT3) and 5'-3'-exoribonuclease 2 (XRN2) during respiratory syncytial virus infection.
140,epmc_rest_api,epmc_xml,PMC3173209,,10.1074/jbc.M111.219212,The T cell receptor triggering apparatus is composed of monovalent or monomeric proteins.
201,unknown,,,,,The Therapeutic Potential of Allosteric Ligands for Free Fatty Acid Sensitive GPCRs
202,unknown,,none,24524173,none,Parasite lost - remembering modern times with Kenyan government medical scientists.
1854,unknown,,none,23873369,10.1387/ijdb.130046jw,The Dictyostelium prestalk inducer DIF-1 directs phosphorylation of a bZIP transcription factor.

Row #,apc_2012_2013_results.csv Journal Type,processed_apc_2012_2013.csv Journal Type,apc_2012_2013.csv PMCID,apc_2012_2013.csv PMID,apc_2012_2013.csv DOI,apc_2012_2013.csv Article title
26,hybrid,,none,,10.1017/S0001972013000478,Tarmacking in the milleninum city: spatial and temporal tralectories of empowerment in Kenya.
55,hybrid,oa,PMC3717731,,10.3390/ijerph10062185,Tobacco use and nicotine dependence among conflict-affected men in Georgia.
202,hybrid,,none,24524173,none,Parasite lost - remembering modern times with Kenyan government medical scientists.

Row #,apc_2012_2013_results.csv Correct Article Confidence,processed_apc_2012_2013.csv Correct Article Confidence,apc_2012_2013.csv PMCID,apc_2012_2013.csv PMID,apc_2012_2013.csv DOI,apc_2012_2013.csv Article title
14,1,0.9,not available,,10.1177/0265691413479085,Images and Meaning - Making in a World of Resemblance: The Bavarian-Saxon Kidney Stone Affair of 1580.
24,1,0.7,none,,10.1017/S0001972013000442,"Stuck in ruins, or up and coming?"
25,1,0.9,none,,10.1017/S0001972013000454,"Pharmacy, money and public health in Dakar."
26,1,,none,,10.1017/S0001972013000478,Tarmacking in the milleninum city: spatial and temporal tralectories of empowerment in Kenya.
28,1,0.9,none,none,10.1017/S0007087413000332,"Writing, printing, speaking: Rhesus blood-group genetics and nomenclatures in the mid-twentieth century"
201,1,0.9,,,,The Therapeutic Potential of Allosteric Ligands for Free Fatty Acid Sensitive GPCRs

Row #,apc_2012_2013_results.csv Standard Compliance?,processed_apc_2012_2013.csv Standard Compliance?,apc_2012_2013.csv PMCID,apc_2012_2013.csv PMID,apc_2012_2013.csv DOI,apc_2012_2013.csv Article title
3,TRUE,False,PMC3724273,,10.1177/0952695112468526,The pursuit of happiness: the social and scientific origins of Hans Selye’s natural philosophy of life’
5,TRUE,False,none,,10.1126/science.1228160,"High coverage of ART associated with decline in risk of HIV acquisition in rural KwaZulu-Natal, South Africa"
6,TRUE,False,PMC3860268,,10.1126/science.1230413,Increase in adult life expectancy
7,TRUE,False,PMC3672848,,10.4049/jimmunol.1201510,Mitochondrial superoxide generation enhances P2X7R-mediated loss of cell surface CD62L on naive human CD4+ T lymphocytes.
13,TRUE,False,PMC3757918,,10.1177/0952695113484320,How autism became autism: the radical transformation of a central concept of child development in Britain
14,FALSE,True,not available,,10.1177/0265691413479085,Images and Meaning - Making in a World of Resemblance: The Bavarian-Saxon Kidney Stone Affair of 1580.
19,FALSE,True,PMC3566749,,10.1017/mdh.2012.81,"I've Never Found Doctors to be a Difficult Bunch': Doctors, Managers and NHS Reorganisations in Manchester and Salford, 1948-2007"
24,FALSE,True,none,,10.1017/S0001972013000442,"Stuck in ruins, or up and coming?"
25,FALSE,True,none,,10.1017/S0001972013000454,"Pharmacy, money and public health in Dakar."
27,TRUE,False,PMC3948080,23158229,10.1017/S1355617712000768,Effects of Maternal Worm Infections and Anthelminthic Treatment during Pregnancy on Infant Motor and Neurocognitive Functioning
30,FALSE,True,none,20146481,10.1021/jm901827x,Toward biophysical probes for the 5-HT3 receptor: structure-activity relationship study of granisetron derivatives
48,TRUE,False,PMC3536734,,10.4161/chan.22153,State-independent intracellular access of quatemary ammonium blockers to the pore of TREK-1
52,TRUE,False,PMC3633361,,10.1093/alcalc/agt006,Post-treatment stage of change predicts 12-month outcome of treatment for alcohol problems
75,TRUE,False,PMC3397896,,10.1074/jbc.M112.377101,Annexin A1 Interaction with the FPR2/ALX Receptor
77,TRUE,False,PMC3137072,,10.1074/jbc.M111.242263,"Characterisation of GAS2-like 3, a new microtubule and actin-binding protein related to spectraplakins"
78,TRUE,False,PMC3522295,,10.1074/jbc.M112.386938,Constitutional mutations in RTEL1 cause severe dyskeratosis congenita
80,TRUE,False,PMC3581401,,10.1074/jbc.M112.416347,Molecular Architecture of a Complex between an Adhesion Protein from the Malaria Parasite and Intracellular Adhesion Molecule 1
84,TRUE,False,PMC3561585,,10.1074/jbc.M112.415372,Distinct roles in autophagy and importance in infectivity of the two ATG4 cysteine peptidases of Leishmania major
86,TRUE,False,PMC3493908,,10.1074/jbc.M112.373969,Dynamic exchange of myosin VI on endocytic structures
87,TRUE,False,PMC3531760,,10.1074/jbc.M112.422402,Contrasting Effects of a-synuclein and y-synuclein on the Phenotype of Cysteine String Protein alpha (CSPa) Null Mutant Mice Suggest Distinct Function of these Proteins in Neuronal Synapses
88,TRUE,False,PMC3436574,,10.1074/jbc.M112.381541,Structural Requirements for Recognition of Major Histocompatibility Complex Class II by Membrane-associated RING-CH (MARCH) Protein E3 Ligases
89,TRUE,False,PMC3516716,,10.1074/jbc.M112.405407,"Novel keto-phospholipids are generated by monocytes and macrophages. Detected in Cystic Fibrosis, and activate peroxisome proliferator-activated receptor-? (Manuscript #M405409)"
93,TRUE,False,PMC3581394,,10.1074/jbc.M112.423012,Immobilization of Heparan Sulfate on Electrospun Meshes to Support Embryonic Stem Cell Culture and Differentiation
94,TRUE,False,PMC2757965,,10.1074/jbc.M109.030338,Mechanisms of activity-dependent plasticity in cellular nitric oxide-cGMP signaling
95,TRUE,False,PMC2962504,,10.1074/jbc.M110.154443,Structural and Functional Investigations of Matrilin-1 A-domains Reveal Insights into Their Role in Cartilage ECM Assembly
96,TRUE,False,PMC3268392,,10.1074/jbc.M111.306563,Photoaffinity labelling of high affinity nicotinic acid adenine dinucleotide 2'-phosphate (NAADP) proteins in sea urchin egg
97,TRUE,False,PMC3554938,,10.1074/jbc.M112.422238,Deubiquitinases regulate the activity of caspase-1 and IL-1β secretion via assembly of the inflammasome
98,TRUE,False,PMC3234717,,10.1074/jbc.M111.272419,Methionine Oxidation of Sup35 Protein Induces Formation of the [PSI+] Prion in a Yeast Peroxiredoxin Mutant
99,TRUE,False,PMC3591638,,10.1074/jbc.M112.428854,Molecular Basis for Jagged-1 Serrate
101,TRUE,False,PMC3234811,,10.1074/jbc.M111.289777,Picomolar nitric oxide signals from central neurons recorded using ultrasensitive detector cells
105,TRUE,False,PMC3597819,,10.1074/jbc.M112.437996,Structural Basis for Cul3 Protein Assembly with the BTB-Kelch Family of E3 Ubiquitin Ligases
106,TRUE,False,PMC3431625,,10.1074/jbc.M111.331157,Opticin Exerts Its Anti-Angiogenic Activity by Regulating Extracellular Matrix Adhesiveness
107,TRUE,False,PMC3488092,,10.1074/jbc.M112.402289,Solution NMR Structure of the Ca2+- Bound N-Terminal Domain of Calcium Binding Protein 7 (CaBP7): A regulator of Golgi trafficking
108,TRUE,False,PMC3308871,,10.1074/jbc.M111.283689,Structural and evolutionary basis for the dual substrate selectivity of human KDM4 histone demethylase family.
109,TRUE,False,PMC3527912,,10.1074/jbc.M112.422089,Structural and functional characterisation of the kindlin-1 pleckstrin homology domain
110,TRUE,False,PMC3265891,,10.1074/jbc.M111.313015,Structural and kinetic evidence that catalytic reaction of human UDP-glucose 6-dehydrogenase involves covalent thiohemiacetal and thioester enzyme intermediates.
111,TRUE,False,PMC3234852,,10.1074/jbc.M111.270751,Inhibitory member of the apoptosis-stimulating proteins of the p53 family (iASPP) interacts with protein phosphatase 1 via a noncanonical binding motif.
113,TRUE,False,PMC3591641,,10.1074/jbc.M112.447524,Expanding the repertoire of amyloiod polymorphs by co-polymerization of related protein precursors
114,TRUE,False,PMC2952269,,10.1074/jbc.M110.128256,SSS1p is required to complete protein translocon activation
115,TRUE,False,PMC3121340,,10.1074/jbc.M111.219568,Preferential Targeting of a Signal Recognition Particle-dependent Precursor
140,TRUE,False,PMC3173209,,10.1074/jbc.M111.219212,The T cell receptor triggering apparatus is composed of monovalent or monomeric proteins.

Row #,apc_2012_2013_results.csv Deluxe Compliance?,processed_apc_2012_2013.csv Deluxe Compliance?,apc_2012_2013.csv PMCID,apc_2012_2013.csv PMID,apc_2012_2013.csv DOI,apc_2012_2013.csv Article title
3,TRUE,False,PMC3724273,,10.1177/0952695112468526,The pursuit of happiness: the social and scientific origins of Hans Selye’s natural philosophy of life’
5,TRUE,False,none,,10.1126/science.1228160,"High coverage of ART associated with decline in risk of HIV acquisition in rural KwaZulu-Natal, South Africa"
6,TRUE,False,PMC3860268,,10.1126/science.1230413,Increase in adult life expectancy
7,TRUE,False,PMC3672848,,10.4049/jimmunol.1201510,Mitochondrial superoxide generation enhances P2X7R-mediated loss of cell surface CD62L on naive human CD4+ T lymphocytes.
13,TRUE,False,PMC3757918,,10.1177/0952695113484320,How autism became autism: the radical transformation of a central concept of child development in Britain
24,FALSE,True,none,,10.1017/S0001972013000442,"Stuck in ruins, or up and coming?"
25,FALSE,True,none,,10.1017/S0001972013000454,"Pharmacy, money and public health in Dakar."
27,TRUE,False,PMC3948080,23158229,10.1017/S1355617712000768,Effects of Maternal Worm Infections and Anthelminthic Treatment during Pregnancy on Infant Motor and Neurocognitive Functioning
30,FALSE,True,none,20146481,10.1021/jm901827x,Toward biophysical probes for the 5-HT3 receptor: structure-activity relationship study of granisetron derivatives
48,TRUE,False,PMC3536734,,10.4161/chan.22153,State-independent intracellular access of quatemary ammonium blockers to the pore of TREK-1
52,TRUE,False,PMC3633361,,10.1093/alcalc/agt006,Post-treatment stage of change predicts 12-month outcome of treatment for alcohol problems
75,TRUE,False,PMC3397896,,10.1074/jbc.M112.377101,Annexin A1 Interaction with the FPR2/ALX Receptor
77,TRUE,False,PMC3137072,,10.1074/jbc.M111.242263,"Characterisation of GAS2-like 3, a new microtubule and actin-binding protein related to spectraplakins"
78,TRUE,False,PMC3522295,,10.1074/jbc.M112.386938,Constitutional mutations in RTEL1 cause severe dyskeratosis congenita
80,TRUE,False,PMC3581401,,10.1074/jbc.M112.416347,Molecular Architecture of a Complex between an Adhesion Protein from the Malaria Parasite and Intracellular Adhesion Molecule 1
84,TRUE,False,PMC3561585,,10.1074/jbc.M112.415372,Distinct roles in autophagy and importance in infectivity of the two ATG4 cysteine peptidases of Leishmania major
86,TRUE,False,PMC3493908,,10.1074/jbc.M112.373969,Dynamic exchange of myosin VI on endocytic structures
87,TRUE,False,PMC3531760,,10.1074/jbc.M112.422402,Contrasting Effects of a-synuclein and y-synuclein on the Phenotype of Cysteine String Protein alpha (CSPa) Null Mutant Mice Suggest Distinct Function of these Proteins in Neuronal Synapses
88,TRUE,False,PMC3436574,,10.1074/jbc.M112.381541,Structural Requirements for Recognition of Major Histocompatibility Complex Class II by Membrane-associated RING-CH (MARCH) Protein E3 Ligases
89,TRUE,False,PMC3516716,,10.1074/jbc.M112.405407,"Novel keto-phospholipids are generated by monocytes and macrophages. Detected in Cystic Fibrosis, and activate peroxisome proliferator-activated receptor-? (Manuscript #M405409)"
93,TRUE,False,PMC3581394,,10.1074/jbc.M112.423012,Immobilization of Heparan Sulfate on Electrospun Meshes to Support Embryonic Stem Cell Culture and Differentiation
94,TRUE,False,PMC2757965,,10.1074/jbc.M109.030338,Mechanisms of activity-dependent plasticity in cellular nitric oxide-cGMP signaling
95,TRUE,False,PMC2962504,,10.1074/jbc.M110.154443,Structural and Functional Investigations of Matrilin-1 A-domains Reveal Insights into Their Role in Cartilage ECM Assembly
96,TRUE,False,PMC3268392,,10.1074/jbc.M111.306563,Photoaffinity labelling of high affinity nicotinic acid adenine dinucleotide 2'-phosphate (NAADP) proteins in sea urchin egg
97,TRUE,False,PMC3554938,,10.1074/jbc.M112.422238,Deubiquitinases regulate the activity of caspase-1 and IL-1β secretion via assembly of the inflammasome
98,TRUE,False,PMC3234717,,10.1074/jbc.M111.272419,Methionine Oxidation of Sup35 Protein Induces Formation of the [PSI+] Prion in a Yeast Peroxiredoxin Mutant
99,TRUE,False,PMC3591638,,10.1074/jbc.M112.428854,Molecular Basis for Jagged-1 Serrate
101,TRUE,False,PMC3234811,,10.1074/jbc.M111.289777,Picomolar nitric oxide signals from central neurons recorded using ultrasensitive detector cells
